{
  "schema_version": 2,
  "record_type": "control_graph_spec",
  "study_id": "SC-0000",
  "control_graph_id": "CG-0000",
  "version": 1,
  "status": "draft",
  "created_at": "1970-01-01T00:00:00Z",
  "updated_at": "1970-01-01T00:00:00Z",
  "previous_ref": null,
  "realizes_intent": {
    "intent_id": "INTENT-0000",
    "version": 1,
    "sha256": "0000000000000000000000000000000000000000000000000000000000000000"
  },
  "executor": {
    "kind": "external",
    "parameters": {}
  },
  "resources": {
    "cpu_hours": 0,
    "gpu_hours": 0,
    "storage_gb": 0,
    "parallel_workers": 1
  },
  "nodes": [],
  "edges": [],
  "completion": {
    "required_node_ids": [],
    "on_incomplete": "record_incomplete"
  },
  "record_sha256": null
}
